{
  "name": "Gibbon",
  "clearOwnership": {
    "isOwnershipExplicit": "Yes",
    "copyrightURL": "https://gibbonedu.org/"
  },
  "platformIndependence": {
    "mandatoryDepsCreateMoreRestrictions": "No",
    "isSoftwarePltIndependent": "",
    "pltIndependenceDesc": ""
  },
  "documentation": {
    "isDocumentationAvailable": "Yes",
    "documentationURL": [
      "https://docs.gibbonedu.org/"
    ]
  },
  "NonPII": {
    "collectsNonPII": "No",
    "checkNonPIIAccessMechanism": "",
    "nonPIIAccessMechanism": ""
  },
  "privacy": {
    "isPrivacyCompliant": "Yes",
    "privacyComplianceList": [
      "EU GDPR",
      "Hong Kong PDPO"
    ],
    "adherenceSteps": [
      ""
    ]
  },
  "standards": {
    "supportStandards": "No",
    "standardsList": [
      ""
    ],
    "evidenceStandardSupport": [
      ""
    ],
    "implementBestPractices": "No",
    "bestPracticesList": [
      ""
    ]
  },
  "doNoHarm": {
    "preventHarm": {
      "stepsToPreventHarm": "Yes",
      "additionalInfoMechanismProcessesPolicies": ""
    },
    "dataPrivacySecurity": {
      "collectsPII": "No",
      "typesOfDataCollected": [
        ""
      ],
      "thirdPartyDataSharing": "No",
      "dataSharingCircumstances": [
        ""
      ],
      "ensurePrivacySecurity": "Yes",
      "privacySecurityDescription": ""
    },
    "inappropriateIllegalContent": {
      "collectStoreDistribute": "No",
      "type": "",
      "contentFilter": "",
      "policyGuidelinesDocumentationLink": "",
      "illegalContentDetection": "",
      "illegalContentDetectionMechanism": ""
    },
    "protectionFromHarassment": {
      "userInteraction": "No",
      "addressSafetySecurityUnderageUsers": "",
      "stepsAddressRiskPreventSafetyUnderageUsers": [
        ""
      ],
      "griefAbuseHarassmentProtection": "",
      "harassmentProtectionSteps": [
        ""
      ]
    }
  },
  "locations": {
    "developmentCountries": [
      "China"
    ],
    "deploymentCountries": [
      "China"
    ]
  }
}
